objectid,filename,title,subject,description,creator,publisher,date,era,type,format,extent,source,language,relation,rights,license,,hasVersion,isPartOf,isReferencedBy,display_template,object_location,image_small,image_thumb,image_alt_text
abb13578,abb13578.tif,"Plakat zur Völkerschau in Basel, 1926",Kolonialismus; Imperialismus; Rassismus; Öffentlichkeit; Kultur,"Im Zeitraum zwischen 1879 und 1935 fanden im Basler Zoo 21 sogenannte «Völkerschauen» statt, in denen Menschen aus verschiedenen Kulturen gezeigt wurden. Dahinter stand ein rassistisches, imperialistisches und kolonialistischen Menschenbild. Die in den Werbeplakaten verwendete Bildsprache stellte die Menschen als «wild», «kriegerisch» und «exotisch» dar, was zu einer Aufrechterhaltung von negativen Stereotypen führte. Die Schauen waren in der Ideologie der «Rassentheorie» verwurzelt, die eine Überlegenheit der europäischen Bevölkerung gegenüber anderen Kulturen behauptete. Diese Überzeugung liess es akzeptabel erscheinen, die Menschen als blosse Objekte zur Belustigung des Publikums zu behandeln.",,StaBS Q2324698,1926,Zeitgeschichte,Image,image/tiff,23376 x 30371,StaBs BSL 1001 N 7,DE,https://dls.staatsarchiv.bs.ch/records/135592,print und print digital (2022-),https://creativecommons.org/publicdomain/mark/1.0/,,,,,,objects/abb13578.tif,objects/small/abb13578_sm.jpg,objects/thumbs/abb13578_th.jpg,
abb40689,abb40689.tif,Schnitzerei am Chorgestühl des Basler Münsters,Antisemitismus; Judentum; Kunst; Religion; Kirche,"Ein Schnitzwerk im Chorgestühl des Basler Münsters aus der Zeit um 1380 zeigt eine beleidigende Darstellung von jüdischen Personen. Das Bild zeigt zwei Personen, die Milch direkt von einer Sau trinken, was eine Karikatur des jüdischen Nahrungstabus für Schweine ist. Dieses Motiv hat eine lange Geschichte von ausgrenzenden und beleidigenden Darstellungen jüdischer Menschen, die bis ins 13. Jahrhundert zurück reicht.",,Denkmalpflege Basel Stadt Q27479725,1384/1390,Mittelalter,Image,image/tiff,3887 x 3619,Sammlung Münsterfoto,,,Foto Hans Grunert,https://rightsstatements.org/page/InC-RUU/1.0/?language=de,,,,,,objects/abb40689.tif,objects/small/abb40689_sm.jpg,objects/thumbs/abb40689_th.jpg,
abb19619,abb19619.tif,Hie Basel Hie Schweizer Boden - Liste 3,Politik; Rassismus; Diskurs; Nationalismus; Nationalstaat; Sozialismus; Werbung ,"Das undatierte Wahlplakat der Bürger- und Gewerbepartei (BGP), das von Otto Plattner erstellt wurde, spiegelt die ideologischen Auswirkungen des Generalstreiks wider. Die bürgerliche Partei versuchte, dem Aufstieg der Kommunistischen Partei (KP) entschieden entgegenzutreten und nutzte dabei rassistische Darstellungen: Auf dem Plakat wird das Schreckgespenst des Kommunismus als eine gewalttätige und ungesunde Menschenmenge dargestellt, die als Bedrohung für die Schweiz und ihre Bürger:innen angesehen wird.",Otto Plattner Q1748710,"Plakatsammlung, Schule für Gestaltung ",1925~,Zeitgeschichte,Image,image/tiff,2877 x 4096,CH-000957-X:4432,Schweizerdeutsch ,https://commons.wikimedia.org/wiki/File:CH-000957-X-4432_Plattner.tif,Wikimedia Commons,https://creativecommons.org/publicdomain/mark/1.0/,,,,,,objects/abb19619.tif,objects/small/abb19619_sm.jpg,objects/thumbs/abb19619_th.jpg,
abb21535,abb21535.jpeg,"Die ausländische Wohnbevölkerung von Basel-Stadt nach Heimatnation, 1920–1965",Asyl; Migration; Minderheit; Integration; Heimat; Gesellschaft; Gesetz,"Die vorliegende Statistik bietet Informationen über den prozentualen Anteil der Bevölkerung im Kanton Basel-Stadt, der im Zeitraum von 1920 bis 1965 eine deutsche, französische oder italienische Staatsbürgerschaft besass. Der grau schraffierte Bereich repräsentiert die «übrigen Nationalitäten»",Stadt.Geschichte.Basel Q122442230,Stadt.Geschichte.Basel Q122442230,1920/1965,Zeitgeschichte,Image,image/jpeg,1450 x 788,,DE,,Public Domain,https://creativecommons.org/publicdomain/mark/1.0/,,,,,,objects/abb21535.jpeg,objects/small/abb21535.jpeg_sm.jpg,objects/thumbs/abb21535.jpeg_th.jpg,
abb42444,abb42444.jpeg,Plan mit Verteilung jüdischer Häuser,Antisemitismus; Judentum; Gesellschaft; Wohnen; Stadt,"Die Karte zeigt die Verteilung von jüdischen Häusern, Gemeinden, Synagogen sowie Friedhöfen im mittelalterlichen Basel. Die erste jüdische Gemeinde ist im Zeitraum von 1200 bis Anfang 1349 datiert und die zweite Gemeinde zwischen 1362 und 1397. Beide Gemeinden besassen eine Synagoge und einen Friedhof. Am 16. Januar 1349 wurde die erste Gemeinde vernichtet. Im Zusammenhang der Pestepidemie wurde die jüdische Gemeinschaft der angeblichen ""Brunnenvergiftung"" bezichtigt und deshalb auf einer Rheininsel bei Basel ermordet. Solche Anklagen und anschliessende Ermordungen fanden zu dieser Zeit nicht nur in Basel statt. Ab 1362 siedelten sich wieder vermehrt jüdische Familien in Basel an. Der Standort der Synagoge hatte sich wohl aufgrund Beschlagnahmung und Enteignung der Synagoge der ersten Gemeinde verschoben. Sie lag nun in der Grünpfahlgasse. ",Stadt.Geschichte.Basel Q122442230,Stadt.Geschichte.Basel Q122442230,1398,Mittelalter,Image,image/jpeg,1421 x 1004,,DE,,Public Domain,https://creativecommons.org/publicdomain/mark/1.0/,,,,,,objects/abb42444.jpeg,objects/small/abb42444.jpeg_sm.jpg,objects/thumbs/abb42444.jpeg_th.jpg,
